### ISSUE TITLE
Leon not called when jobs need to killed (oardel)

### ISSUE THREAD

**Issue by bzizou** [oar-team/oar3#83]
Jobs not responding to oardel should be EXTERMINATED after JOBDEL_WALLTIME but it never happens

I added debug to sarko.py to check which condition fails to occur...

**Comment by bzizou** [comment]
We have a lot of lines like this into the logs:

```
[   DEBUG] [2025-06-18 08:47:35,227] [oar.modules.bipbip_commander::run:163]: Timeout on notification:Resource temporarily unavailable
```

**Comment by bzizou** [comment]
We also have such messages on dahu-oar3, but slightly different (on ::qget, not on ::run):

```
[   DEBUG] [2025-06-18 08:55:55,641] [oar.modules.almighty::qget:310]: Timeout from appendice:Resource temporarily unavailable
```

**Comment by bzizou** [comment]
More diags on this issue:
- It randomly works... sometimes, a oardel notfies correctly Leon. And when it works, all oardel are working correctly. But when it does not work, even restart oar-server does not make it work again

- tcpdump reveals some incorrect checksums on the zmq bus:
```
...
11:49:53.079388 IP (tos 0x0, ttl 64, id 5554, offset 0, flags [DF], proto TCP (6), length 52)                                                                       
    localhost.6671 > localhost.37518: Flags [.], cksum 0xfe28 (incorrect -> 0x10f2), ack 1367, win 512, options [nop,nop,TS val 1944131965 ecr 1944131965], length 0
11:49:53.247663 IP (tos 0x0, ttl 64, id 29503, offset 0, flags [DF], proto TCP (6), length 101)                                                                     
    localhost.37518 > localhost.6671: Flags [P.], cksum 0xfe59 (incorrect -> 0x0f14), seq 1367:1416, ack 93, win 512, options [nop,nop,TS val 1944132133 ecr 1944131
965], length 49                                                                                                                                                     
11:49:53.247672 IP (tos 0x0, ttl 64, id 5555, offset 0, flags [DF], proto TCP (6), length 52)                                                                       
    localhost.6671 > localhost.37518: Flags [.], cksum 0xfe28 (incorrect -> 0x0f71), ack 1416, win 512, options [nop,nop,TS val 1944132133 ecr 1944132133], length 0
11:49:53.416993 IP (tos 0x0, ttl 64, id 29504, offset 0, flags [DF], proto TCP (6), length 101)                                                                     
    localhost.37518 > localhost.6671: Flags [P.], cksum 0xfe59 (incorrect -> 0x0c92), seq 1416:1465, ack 93, win 512, options [nop,nop,TS val 1944132302 ecr 1944132
133], length 49                                                                                                                                                     
11:49:53.417001 IP (tos 0x0, ttl 64, id 5556, offset 0, flags [DF], proto TCP (6), length 52)                                                                       
    localhost.6671 > localhost.37518: Flags [.], cksum 0xfe28 (incorrect -> 0x0dee), ack 1465, win 512, options [nop,nop,TS val 1944132302 ecr 1944132302], length 0
11:49:53.586194 IP (tos 0x0, ttl 64, id 29505, offset 0, flags [DF], proto TCP (6), length 101)                                                                     
    localhost.37518 > localhost.6671: Flags [P.], cksum 0xfe59 (incorrect -> 0x0a0e), seq 1465:1514, ack 93, win 512, options [nop,nop,TS val 1944132472 ecr 1944132
302], length 49                                                                                                                                                     
11:49:53.586203 IP (tos 0x0, ttl 64, id 5557, offset 0, flags [DF], proto TCP (6), length 52)                                                                       
    localhost.6671 > localhost.37518: Flags [.], cksum 0xfe28 (incorrect -> 0x0c69), ack 1514, win 512, options [nop,nop,TS val 1944132472 ecr 1944132472], length 0
11:49:53.782816 IP (tos 0x0, ttl 64, id 29506, offset 0, flags [DF], proto TCP (6), length 52)                                                                      
    localhost.37518 > localhost.6671: Flags [F.], cksum 0xfe28 (incorrect -> 0x0ba4), seq 1514, ack 93, win 512, options [nop,nop,TS val 1944132668 ecr 1944132472],
 length 0                                                                                                                                                           
...
```

**Comment by bzizou** [comment]
I think that I get it!!

https://github.com/oar-team/oar3/blob/2894e1b05051a097e3f6fd8142397c0710297e7e/oar/modules/almighty.py#L232

1 second is not enough to empty all the queue, so when there's a lot of jobs statring/finishing or nodes to change state, we have never time enough to get in the Leon state and we schedule!!! Should be 5 seconds as the DEFAULT

Best: we should have a test to check if the queue is empty, and if not, don't start the scheduler

**Comment by augu5te** [comment]
Great, we should have a better Leon/job delete request handling in central automaton (Almighty) to avoid this kind of starvation. Timing approach is not robust enough.
